<!ELEMENT dataset (
    FNBL_DEVICE_CONFIG*)>

<!ELEMENT FNBL_DEVICE_CONFIG EMPTY>
<!ATTLIST FNBL_DEVICE_CONFIG
    USERNAME    CDATA #REQUIRED
    PRINCIPAL   CDATA #REQUIRED
    URI         CDATA #REQUIRED
    VALUE       CDATA #IMPLIED
    LAST_UPDATE CDATA #IMPLIED
    STATUS      CDATA #IMPLIED
    ENCRYPTED   CDATA #IMPLIED
>